{
  "$schema": "../../doc/schema/record_use.schema.json",
  "constants": [
    {
      "type": "bool",
      "value": true
    },
    {
      "type": "int",
      "value": 1
    },
    {
      "type": "string",
      "value": "bool-key"
    },
    {
      "type": "string",
      "value": "int-key"
    },
    {
      "type": "map",
      "value": [
        {
          "key": 0,
          "value": 2
        },
        {
          "key": 1,
          "value": 3
        }
      ]
    }
  ],
  "definitions": [
    {
      "path": [
        {
          "kind": "class",
          "name": "SomeClass"
        },
        {
          "disambiguators": [
            "static"
          ],
          "kind": "method",
          "name": "someStaticMethod"
        }
      ],
      "uri": "package:record_use_test/map_complex_keys.dart"
    }
  ],
  "loading_units": [
    {
      "name": "1"
    }
  ],
  "uses": {
    "static_calls": [
      {
        "definition_index": 0,
        "uses": [
          {
            "loading_unit_index": 0,
            "positional": [
              4
            ],
            "type": "with_arguments"
          }
        ]
      }
    ]
  }
}
