{
  "$schema": "../../doc/schema/record_use.schema.json",
  "constants": [
    {
      "type": "non_constant"
    },
    {
      "type": "string",
      "value": "hello-world"
    }
  ],
  "definitions": [
    {
      "path": [
        {
          "disambiguators": [
            "static"
          ],
          "kind": "method",
          "name": "Ext|foo"
        }
      ],
      "uri": "package:record_use_test/named_with_function_arg.dart"
    }
  ],
  "loading_units": [
    {
      "name": "1"
    }
  ],
  "uses": {
    "static_calls": [
      {
        "definition_index": 0,
        "uses": [
          {
            "loading_unit_index": 0,
            "named": {
              "s": 1
            },
            "positional": [
              0
            ],
            "type": "with_arguments"
          }
        ]
      }
    ]
  }
}
