{
  "$schema": "../../doc/schema/record_use.schema.json",
  "constants": [
    {
      "type": "int",
      "value": 0
    },
    {
      "type": "string",
      "value": "a"
    },
    {
      "definition_index": 0,
      "type": "instance",
      "value": {
        "_name": 1,
        "index": 0
      }
    },
    {
      "definition_index": 0,
      "type": "instance",
      "value": {
        "a": 2
      }
    }
  ],
  "definitions": [
    {
      "path": [
        {
          "kind": "class",
          "name": "MyClass"
        }
      ],
      "uri": "package:record_use_test/record_enum.dart"
    }
  ],
  "loading_units": [
    {
      "name": "1"
    }
  ],
  "uses": {
    "instances": [
      {
        "definition_index": 0,
        "uses": [
          {
            "constant_index": 3,
            "loading_unit_index": 0,
            "type": "constant"
          }
        ]
      }
    ]
  }
}
