{
  "$schema": "../../doc/schema/record_use.schema.json",
  "constants": [
    {
      "definition_index": 0,
      "type": "instance"
    }
  ],
  "definitions": [
    {
      "path": [
        {
          "kind": "class",
          "name": "MyClass"
        }
      ],
      "uri": "package:record_use_test/instance_not_annotation.dart"
    }
  ],
  "loading_units": [
    {
      "name": "1"
    }
  ],
  "uses": {
    "instances": [
      {
        "definition_index": 0,
        "uses": [
          {
            "constant_index": 0,
            "loading_unit_index": 0,
            "type": "constant"
          }
        ]
      }
    ]
  }
}
